<?xml version="1.0" encoding="utf-8"?>
<!-- Dialogue Tree -->
<xs:schema xmlns:xs="http://www.w3.org/2001/XMLSchema">
    <!-- Empty Type -->
    <xs:complexType name="empty"/>
    
    <!-- Dialogue Tree Info -->
    <xs:element name="DialogueTree">
        <xs:complexType>
            <xs:sequence>
                <xs:element name="NameField" type="xs:string" minOccurs="1" maxOccurs="1">
                    <xs:annotation>
                        <xs:documentation>
                            The name of the character, used for the interaction prompt. Set to `SIGN` for the prompt
                            "Read", or `RECORDING` for "Play Recording"
                        </xs:documentation>
                    </xs:annotation>
                </xs:element>
                <xs:element name="DialogueNode" type="DialogueNode" minOccurs="1" maxOccurs="unbounded">
                    <xs:annotation>
                        <xs:documentation>
                            The different nodes of this dialogue tree
                        </xs:documentation>
                    </xs:annotation>
                </xs:element>
            </xs:sequence>
        </xs:complexType>
    </xs:element>

    <!-- Dialogue Node Info -->
    <xs:complexType name="DialogueNode">
        <xs:sequence>
            <xs:element name="Name" type="xs:string" minOccurs="1" maxOccurs="1">
                <xs:annotation>
                    <xs:documentation>
                        The name of this dialogue node
                    </xs:documentation>
                </xs:annotation>
            </xs:element>
            <xs:element name="EntryCondition" type="xs:string" minOccurs="0" maxOccurs="unbounded">
                <xs:annotation>
                    <xs:documentation>
                        The condition that needs to be met in order for the dialogue to begin at this node. There must
                        be one node that has a value of `DEFAULT`
                    </xs:documentation>
                </xs:annotation>
            </xs:element>
            <xs:element name="Randomize" type="empty" minOccurs="0" maxOccurs="1">
                <xs:annotation>
                    <xs:documentation>
                        When used with multiple Dialogues, the node will choose a random one to show
                    </xs:documentation>
                </xs:annotation>
            </xs:element>
            <xs:element name="Dialogue" type="Dialogue" minOccurs="0" maxOccurs="unbounded">
                <xs:annotation>
                    <xs:documentation>
                        The dialogue to show to the player
                    </xs:documentation>
                </xs:annotation>
            </xs:element>
            <xs:element name="RevealFacts" type="RevealFacts" minOccurs="0" maxOccurs="1">
                <xs:annotation>
                    <xs:documentation>
                        Facts to reveal when the player goes through this dialogue node
                    </xs:documentation>
                </xs:annotation>
            </xs:element>
            <xs:element name="SetPersistentCondition" type="xs:string" minOccurs="0" maxOccurs="1">
                <xs:annotation>
                    <xs:documentation>
                        Set a new persistent condition that will last indefinitely in the current save, unless cancelled
                        or deleted
                    </xs:documentation>
                </xs:annotation>
            </xs:element>
            <xs:element name="SetCondition" type="xs:string" minOccurs="0" maxOccurs="unbounded">
                <xs:annotation>
                    <xs:documentation>
                        Set a new condition that will only last for the current loop
                    </xs:documentation>
                </xs:annotation>
            </xs:element>
            <xs:element name="DisablePersistentCondition" type="xs:string" minOccurs="0" maxOccurs="1">
                <xs:annotation>
                    <xs:documentation>
                        Disable a set persistent condition from the current save
                    </xs:documentation>
                </xs:annotation>
            </xs:element>
            <xs:element name="DialogueTargetShipLogCondition" type="xs:string" minOccurs="0" maxOccurs="unbounded">
                <xs:annotation>
                    <xs:documentation>
                        A ship log fact that must be revealed in order to proceed to the `DialogueTarget`
                    </xs:documentation>
                </xs:annotation>
            </xs:element>
            <xs:element name="DialogueTarget" type="xs:string" minOccurs="0" maxOccurs="1">
                <xs:annotation>
                    <xs:documentation>
                        The name of the `DialogueNode` to go to after this node. Mutually exclusive with
                        `DialogueOptionsList` here
                    </xs:documentation>
                </xs:annotation>
            </xs:element>
            <xs:element name="DialogueOptionsList" type="DialogueOptionsList" minOccurs="0" maxOccurs="1">
                <xs:annotation>
                    <xs:documentation>
                        A list of options to show to the player once the character is done talking
                    </xs:documentation>
                </xs:annotation>
            </xs:element>
        </xs:sequence>
    </xs:complexType>

    <!-- Dialogue Info -->
    <xs:complexType name="Dialogue">
        <xs:sequence>
            <xs:element name="Page" type="xs:string" minOccurs="1" maxOccurs="unbounded">
                <xs:annotation>
                    <xs:documentation>
                        A page of dialogue to show to the player
                    </xs:documentation>
                </xs:annotation>
            </xs:element>
        </xs:sequence>
    </xs:complexType>

    <!-- Reveal Facts Info -->
    <xs:complexType name="RevealFacts">
        <xs:sequence>
            <xs:element name="FactID" type="xs:string" minOccurs="1" maxOccurs="unbounded">
                <xs:annotation>
                    <xs:documentation>
                        The ID of a fact to reveal
                    </xs:documentation>
                </xs:annotation>
            </xs:element>
        </xs:sequence>
    </xs:complexType>

    <!-- Dialogue Options List Info -->
    <xs:complexType name="DialogueOptionsList">
        <xs:sequence>
            <xs:element name="DialogueOption" type="DialogueOption" minOccurs="0" maxOccurs="unbounded">
                <xs:annotation>
                    <xs:documentation>
                        Options the player can select from
                    </xs:documentation>
                </xs:annotation>
            </xs:element>
            <xs:element name="ReuseDialogueOptionsListFrom" type="xs:string" minOccurs="0" maxOccurs="1">
                <xs:annotation>
                    <xs:documentation>
                        Name of another `DialogueNode` whose options you want to repeat to avoid having to copy paste.
                        Will override any `DialogueOption`s.
                    </xs:documentation>
                </xs:annotation>
            </xs:element>
        </xs:sequence>
    </xs:complexType>

    <!-- Dialogue Option Info -->
    <xs:complexType name="DialogueOption">
        <xs:sequence>
            <xs:element name="RequiredLogCondition" type="xs:string" minOccurs="0" maxOccurs="unbounded">
                <xs:annotation>
                    <xs:documentation>
                        Require a ship log fact to be known to show this option
                    </xs:documentation>
                </xs:annotation>
            </xs:element>
            <xs:element name="RequiredPersistentCondition" type="xs:string" minOccurs="0" maxOccurs="unbounded">
                <xs:annotation>
                    <xs:documentation>
                        Require a persistent condition to be met to show this option
                    </xs:documentation>
                </xs:annotation>
            </xs:element>
            <xs:element name="CancelledPersistentCondition" type="xs:string" minOccurs="0" maxOccurs="unbounded">
                <xs:annotation>
                    <xs:documentation>
                        Hide this option if a persistent condition has been met
                    </xs:documentation>
                </xs:annotation>
            </xs:element>
            <xs:element name="RequiredCondition" type="xs:string" minOccurs="0" maxOccurs="1">
                <xs:annotation>
                    <xs:documentation>
                        Require a (single-loop) condition to be met to show this option
                    </xs:documentation>
                </xs:annotation>
            </xs:element>
            <xs:element name="CancelledCondition" type="xs:string" minOccurs="0" maxOccurs="1">
                <xs:annotation>
                    <xs:documentation>
                        Hide this option if a (single-loop) condition has been met
                    </xs:documentation>
                </xs:annotation>
            </xs:element>
            <xs:element name="Text" type="xs:string" minOccurs="1" maxOccurs="1">
                <xs:annotation>
                    <xs:documentation>
                        The text to show for this option
                    </xs:documentation>
                </xs:annotation>
            </xs:element>
            <xs:element name="DialogueTarget" type="xs:string" minOccurs="0" maxOccurs="1">
                <xs:annotation>
                    <xs:documentation>
                        The name of the `DialogueNode` to go to when this option is selected
                    </xs:documentation>
                </xs:annotation>
            </xs:element>
            <xs:element name="ConditionToSet" type="xs:string" minOccurs="0" maxOccurs="1">
                <xs:annotation>
                    <xs:documentation>
                        Set a condition when this option is chosen
                    </xs:documentation>
                </xs:annotation>
            </xs:element>
            <xs:element name="ConditionToCancel" type="xs:string" minOccurs="0" maxOccurs="1">
                <xs:annotation>
                    <xs:documentation>
                        Cancel a condition when this option is chosen
                    </xs:documentation>
                </xs:annotation>
            </xs:element>
        </xs:sequence>
    </xs:complexType>
</xs:schema>
