<DialogueTree xmlns:xsi="http://www.w3.org/2001/XMLSchema-instance" xsi:noNamespaceSchemaLocation="https://raw.githubusercontent.com/Outer-Wilds-New-Horizons/new-horizons/main/NewHorizons/Schemas/dialogue_schema.xsd">
	<NameField>New Horizons</NameField>

	<DialogueNode>
		<Name>NEW_HORIZONS_WARP_DRIVE_DIALOGUE</Name>
		<EntryCondition>DEFAULT</EntryCondition>
		<Dialogue>
			<Page>NEW_HORIZONS_WARP_DRIVE_DIALOGUE_1</Page>
			<Page>NEW_HORIZONS_WARP_DRIVE_DIALOGUE_2</Page>
			<Page>NEW_HORIZONS_WARP_DRIVE_DIALOGUE_3</Page>
		</Dialogue>
		<SetPersistentCondition>KnowsAboutWarpDrive</SetPersistentCondition>
	</DialogueNode>

</DialogueTree>